{
  "tool": "switch_registry",
  "registry_version": "2026-07-04T10:00:00+09:00",
  "switches": [
    {
      "id": "SW-001",
      "name": "Block APAC Logins",
      "status": "OFF",
      "evidence_status": "Verified"
    }
  ],
  "log": [
    {
      "timestamp": "2026-07-04T09:41:00+09:00",
      "switch_id": "SW-001",
      "action": "OFF->ON",
      "actor": "Alice"
    }
  ],
  "change_log": []
}